{
  "schema_version": "1.1.0",
  "receipt_id": "rcpt-001",
  "request_id": "req-001",
  "trace_id": "trace-001",
  "packet_id": "pkt-001",
  "packet_class": "answer_packet",
  "version_set": {
    "contract_version": "1.0.0",
    "runtime_version": "0.1.0",
    "corpus_version": "0.1.0",
    "budget_version": "1.0.0",
    "compatibility_posture": "compatible"
  },
  "retrieval_mode": "hybrid",
  "pruning_mode": "standard",
  "serialization_profile": "plain_text_only",
  "serialization_evidence": {
    "schema_version": "1.0.0",
    "requested_profile": "plain_text_only",
    "used_profile": "plain_text_only",
    "render_attempted": true,
    "fallback_used": true,
    "fallback_reason": "renderer_unavailable",
    "artifact_kind": "plain_text",
    "artifact_version": "1.0.0",
    "artifact_hash": "sha256:0000000000000000000000000000000000000000000000000000000000000000",
    "segment_meta": null,
    "token_estimates": {
      "before_tokens": 3900,
      "after_tokens": 2400,
      "delta_tokens": -1500,
      "reduction_percentage": 38.5,
      "estimator_family": "heuristic"
    }
  },
  "degradation_state": "retrieval_degraded",
  "source_lineage_digest": {
    "digest_algorithm": "sha256",
    "digest": "abcd1234abcd1234",
    "source_scope": "packet"
  },
  "packet_hash": "hashvalue00000001",
  "token_counts": {
    "input_tokens": 2400,
    "naive_baseline_tokens": 3900,
    "reduction_percentage": 38.5
  },
  "latency_breakdown": {
    "retrieval_ms": 120,
    "rerank_prune_ms": 85,
    "compile_validate_ms": 40,
    "total_pact_overhead_ms": 245
  },
  "model_call_allowed": true,
  "safe_failure_invoked": false
}
